20	3.11  Nālaka, Asita and the Buddha’s advice	Taṁ nadīhi vijānātha, Sobbhesu padaresu ca; Saṇantā yanti kusobbhā, Tuṇhī yanti mahodadhī.	Understand this by the way streams move  in clefts and crevices: the little creeks flow on babbling, while silent flow the great rivers.	“Understand this by way of rivers and in terms of clefts and ravines. The creeks flow on noisily, but silently the great rivers flow.		Know from the rivers in clefts &in crevices: Those in small channels flow noisily, the great flow silent.	Know this from waters’ flow— those by rocks and pools— such rills and becks gush noisily, great waterways flow quiet.		720	
21	3.11  Nālaka, Asita and the Buddha’s advice	Yadūnakaṁ taṁ saṇati, Yaṁ pūraṁ santameva taṁ; Aḍḍhakumbhūpamo bālo, Rahado pūrova paṇḍito.	What is lacking, babbles; what is full is at peace. The fool is like a half-full pot; the wise like a brimfull lake.	“What is empty makes a noise; what is full is ever quiet. The fool is like a half-full barrel, the wise man like a full lake.		Whatever’s deficient makes noise. Whatever is full is quiet. The fool is like a half-empty pot; one who is wise, a full lake.	What is unfilled makes noise but silent is what’s full, the fool is like the pot half-filled, the wise one’s like a lake that’s full.		721	
22	3.11  Nālaka, Asita and the Buddha’s advice	Yaṁ samaṇo bahuṁ bhāsati, Upetaṁ atthasañhitaṁ; Jānaṁ so dhammaṁ deseti, Jānaṁ so bahu bhāsati.	When the Ascetic speaks much it is relevant and meaningful: knowing, he teaches the Dhamma; knowing, he speaks much.	“When the Ascetic speaks much,184 it is meaningful and beneficial. Knowing, he teaches the Dhamma; knowing, he speaks much.		A contemplative who speaks a great deal endowed with meaning: Knowing, he teaches the Dhamma; knowing, he speaks a great deal.	When a samaṇa speaks much full of goodness and meaning: Knowing Dharma he speaks, Knowing he speaks so much.		722	
23	3.11  Nālaka, Asita and the Buddha’s advice	Yo ca jānaṁ saṁyatatto, Jānaṁ na bahu bhāsati; Sa munī monamarahati, Sa munī monamajjhagā”ti.	But one who, knowing, is restrained, knowing, does not speak much; that sage is worthy of sagacity, that sage has achieved sagacity.”	“But one who, knowing, is self-controlled, who, knowing, does not speak much: that muni is worthy of munihood; that muni has achieved munihood.”		But he who, knowing, is restrained, knowing, doesn’t speak a great deal: He is a sage worthy of sagehood. He is a sage, his sagehood attained.”	But who, Knowing, is self-restrained, Knowing, he speaks not much: That Sage is worth to Silence, a Sage to Silence reached.		723	
1	1.3 KHAGGAVISĀṆA Rhinoceros horn Teaching for the Hermit-minded	Sabbesu bhūtesu nidhāya daṇḍaṁ, Aviheṭhayaṁ aññatarampi tesaṁ; Na puttamiccheyya kuto sahāyaṁ, Eko care khaggavisāṇakappo	When you’ve laid down arms toward all creatures, not harming even a single one, don’t wish for a child, let alone a companion: live alone like a rhino’s horn.	Having put down the rod toward all beings, not harming a single one among them, one should not desire a son, how then a companion? One should live alone like a rhinoceros horn.		Renouncing violence for all living beings, harming not even one of them, you would not wish for offspring, so how a companion? Wander alone1 like a rhinoceros.	Put by the rod for all that lives, tormenting not a single one; long not for child, how then for friend? fare singly as the rhino’s horn		35	See also: SN 21:10; SN 35:63; AN 9:40; Ud 4:5; Iti 15; Iti 38
2	1.3 KHAGGAVISĀṆA Rhinoceros horn Teaching for the Hermit-minded	Saṁsaggajātassa bhavanti snehā, Snehanvayaṁ dukkhamidaṁ pahoti; Ādīnavaṁ snehajaṁ pekkhamāno, Eko care khaggavisāṇakappo”.	Those with close relationships have affection, following which this pain arises. Seeing this danger born of affection, live alone like a rhino’s horn.	For one who has formed bonds, there is affection;66 following on affection, this suffering arises. Discerning the danger born of affection, one should live alone like a rhinoceros horn.		For a person by nature entangled there are affections; on the heels of affection, this pain. Seeing the drawback born of affection, wander alone like a rhinoceros.	Attraction comes from meetings with, and from attraction dukkha’s born; see danger of attraction then, fare singly as the rhino’s horn		36	
3	1.3 KHAGGAVISĀṆA Rhinoceros horn Teaching for the Hermit-minded	Mitte suhajje anukampamāno, Hāpeti atthaṁ paṭibaddhacitto; Etaṁ bhayaṁ santhave pekkhamāno, Variant: santhave → sandhave (mr) Eko care khaggavisāṇakappo	When feelings for friends and loved ones are tied up in selfish love, you miss out on the goal. Seeing this peril in intimacy, live alone like a rhino’s horn.	Sympathizing with friends dear to one’s heart, with mind attached, one forsakes the good. Seeing this peril in intimacy, one should live alone like a rhinoceros horn.		One whose mind is enmeshed in sympathy for friends &companions, neglects the goal. Seeing this danger in intimacy, wander alone like a rhinoceros.	One full of ruth for friends well-loved with mind attached,² neglects the good, seeing this danger in association, fare singly as the rhino’s horn		37	
4	1.3 KHAGGAVISĀṆA Rhinoceros horn Teaching for the Hermit-minded	Vaṁso visālova yathā visatto, Puttesu dāresu ca yā apekkhā; Vaṁsakkaḷīrova asajjamāno, Variant: Vaṁsakkaḷīrova → vaṁsakaḷīrova (bj); vaṁsākaḷīro va (sya-all, km, pts-vp-pli1) Eko care khaggavisāṇakappo	As a spreading bamboo gets entangled, so does concern for partners and children. Like a bamboo shoot unimpeded, live alone like a rhino’s horn	As widespread bamboo becomes entwined, just so is concern for wives and sons. [7] But like a bamboo shoot, not getting stuck,67 one should live alone like a rhinoceros horn.		Like spreading bamboo, entwined, is concern for offspring &spouses. Like a bamboo sprout, unentangling, wander alone like a rhinoceros.	Tangled as the crowding bamboo boughs is fond regard for partner, child: as the tall tops are tangle-free, fare singly as the rhino’s horn		38	
5	1.3 KHAGGAVISĀṆA Rhinoceros horn Teaching for the Hermit-minded	Migo araññamhi yathā abaddho, Variant: abaddho → abandho (sya-all, km) Yenicchakaṁ gacchati gocarāya; Viññū naro seritaṁ pekkhamāno, Eko care khaggavisāṇakappo	As a wild deer loose in the forest grazes wherever it wants, a smart person looking for freedom would live alone like a rhino’s horn.	As a deer unbound in the forest goes off to graze wherever it wants, so a wise person, looking out for freedom, should live alone like a rhinoceros horn.		As a deer in the wilds, unfettered,2 goes for forage wherever it wants: The observant person, valuing freedom, wanders alone like a rhinoceros.	The deer untethered roams the woods going where’er it wants to graze: seeing its liberty, wise one, fare singly as the rhino’s horn.		39	
6	1.3 KHAGGAVISĀṆA Rhinoceros horn Teaching for the Hermit-minded	Āmantanā hoti sahāyamajjhe, Vāse ṭhāne gamane cārikāya; Anabhijjhitaṁ seritaṁ pekkhamāno, Eko care khaggavisāṇakappo”.	When among friends, whether staying in place or going on a journey, you’re always on call. Looking for the uncoveted freedom, live alone like a rhino’s horn.	One is addressed in the midst of companions, whether resting, standing, going, or traveling. Looking out for the freedom that is not coveted, one should live alone like a rhinoceros horn.		In the midst of companions —when staying at home, when going out wandering— you are prey to requests. Valuing the freedom that no one else covets, wander alone like a rhinoceros.	Mong friends one’s asked for this or that, when resting, standing, going on tour, seeing the liberty few desire, fare singly as the rhino’s horn		40	
7	1.3 KHAGGAVISĀṆA Rhinoceros horn Teaching for the Hermit-minded	Khiḍḍā ratī hoti sahāyamajjhe, Puttesu ca vipulaṁ hoti pemaṁ; Piyavippayogaṁ vijigucchamāno, Eko care khaggavisāṇakappo”	Among friends you have fun and games, and for children you are full of love. Though loathe to depart from those you hold dear, live alone like a rhino’s horn.	There is play and delight in the midst of companions, and affection for one’s sons is vast. Averse to separation from those who are dear, one should live alone like a rhinoceros horn.		There is sporting &love in the midst of companions, &abundant love for offspring. Feeling disgust at the prospect of parting from those who’d be dear, wander alone like a rhinoceros.	’Mong friends there’s sexy playfulness, and love for children’s very great, while loath to part from those beloved, fare singly as the rhino’s horn		41	
8	1.3 KHAGGAVISĀṆA Rhinoceros horn Teaching for the Hermit-minded	Cātuddiso appaṭigho ca hoti, Santussamāno itarītarena; Parissayānaṁ sahitā achambhī, Eko care khaggavisāṇakappo”	At ease in any quarter, unresisting, content with whatever comes your way; prevailing over adversities, dauntless, live alone like a rhino’s horn.	At home in the four directions, unrepelled, contented with anything whatsoever, enduring obstacles, fearless, one should live alone like a rhinoceros horn.		Without resistance in all four directions, content with whatever you get, enduring troubles without panic, wander alone like a rhinoceros.	Resentment none to quarters four, and well-content with this and that, enduring dangers undismayed, fare singly as the rhino’s horn.		42	
9	1.3 KHAGGAVISĀṆA Rhinoceros horn Teaching for the Hermit-minded	Dussaṅgahā pabbajitāpi eke, Atho gahaṭṭhā gharamāvasantā; Appossukko paraputtesu hutvā, Eko care khaggavisāṇakappo”.	Even some renunciates are hard to please, as are some layfolk dwelling at home. Don’t worry about others’ children, live alone like a rhino’s horn.	Even some monastics are hard to please; so, too, householders living at home. Being unconcerned about others’ sons, one should live alone like a rhinoceros horn.		They are hard to please, some of those gone forth, as well as those living the household life. Being unconcerned with the offspring of others, wander alone like a rhinoceros.	Some home-forsakers ill consort, as householders who live at home; be unconcerned with others’ kids! fare singly as the rhino’s horn		43	
10	1.3 KHAGGAVISĀṆA Rhinoceros horn Teaching for the Hermit-minded	Oropayitvā gihibyañjanāni, Sañchinnapatto yathā koviḷāro; Variant: Sañchinnapatto → saṁsīnapatto (bj, pts-vp-pli1) Chetvāna vīro gihibandhanāni, Eko care khaggavisāṇakappo”	Having shed the marks of the home life, like the fallen leaves of the Shady Orchid Tree; having cut the bonds of the home life, a hero would live alone like a rhino’s horn.	Having discarded the marks of a layman like a koviḷāra tree whose leaves are shed,68 [8] having cut off a layman’s bonds, the hero should live alone like a rhinoceros horn.		Cutting off the householder’s marks,3 like a kovilara tree that has shed its leaves, the enlightened one, cutting all household ties, wanders alone like a rhinoceros.	Let fall the marks of householder, as Koviḷāra’s parted leaves; a hero, having house-ties cut, fare singly as the rhino’s horn.		44	
11	1.3 KHAGGAVISĀṆA Rhinoceros horn Teaching for the Hermit-minded	Sace labhetha nipakaṁ sahāyaṁ, Saddhiṁ caraṁ sādhuvihāridhīraṁ; Abhibhuyya sabbāni parissayāni, Careyya tenattamano satīmā	If you find an alert companion, a wise and virtuous friend, then, overcoming all adversities, wander with them, joyful and mindful	If one should find a judicious companion, a fellow wanderer, of good behavior, resolute, having overcome all obstacles, one should live with him, satisfied and mindful.		If you gain an astute companion, a fellow traveler, right-living, enlightened, overcoming all troubles, go with him, gratified, mindful.	For practice if one finds a friend— prudent, well-behaved, and wise, mindful, joyful, live as one all troubles overcoming		45	
12	1.3 KHAGGAVISĀṆA Rhinoceros horn Teaching for the Hermit-minded	No ce labhetha nipakaṁ sahāyaṁ, Saddhiṁ caraṁ sādhuvihāridhīraṁ; Rājāva raṭṭhaṁ vijitaṁ pahāya, Eko care mātaṅgaraññeva nāgo”. Variant: mātaṅgaraññeva nāgo → khaggavisāṇakappo (bj, pts-vp-pli1)	If you find no alert companion, no wise and virtuous friend, then, like a king who flees his conquered realm, wander alone like a tusker in the wilds	But if one does not find a judicious companion, a fellow wanderer, of good behavior, resolute, like a king who has abandoned a conquered realm,70 one should live alone like a rhinoceros horn.71		If you don’t gain an astute companion, a fellow traveler, right-living &wise, wander alone like a king renouncing his kingdom, like the elephant in the Mataṅga wilds, [his herd].4	But if you do not find a friend— prudent, well-behaved, and wise, then like a king who leaves his conquered lands, fare singly as the rhino’s horn		46	
13	1.3 KHAGGAVISĀṆA Rhinoceros horn Teaching for the Hermit-minded	Addhā pasaṁsāma sahāyasampadaṁ, Seṭṭhā samā sevitabbā sahāyā; Ete aladdhā anavajjabhojī, Eko care khaggavisāṇakappo	Clearly we praise the blessing of a friend, it’s good to be with friends your equal or better. but failing to find them, eating blamelessly, live alone like a rhino’s horn.	Surely, we praise the excellence of companionship: one should resort to companions one’s equal or better. Not obtaining these, as one who eats blamelessly one should live alone like a rhinoceros horn.		We praise companionship —yes! Those on a par, or better, should be chosen as friends. If they’re not to be found, living faultlessly, wander alone like a rhinoceros.	Surely we praise accomplished friends— choose friends who’re equal, or the best; not finding these, live blamelessly, fare singly as the rhino’s horn.		47	
14	1.3 KHAGGAVISĀṆA Rhinoceros horn Teaching for the Hermit-minded	Disvā suvaṇṇassa pabhassarāni, Kammāraputtena suniṭṭhitāni; Saṅghaṭṭamānāni duve bhujasmiṁ, Variant: Saṅghaṭṭamānāni → saṅghaṭṭayantāni (…) Eko care khaggavisāṇakappo	Though made of shining gold, well-finished by a smith, when two bracelets share the same arm they clash up against each other. Seeing this, live alone like a rhino’s horn.	Having seen radiant [bracelets] of gold, skillfully fashioned by a goldsmith, clashing together in pairs on the arm, one should live alone like a rhinoceros horn.		Seeing radiant bracelets of gold, well-made by a smith, clinking, clashing, two on an arm, wander alone like a rhinoceros,	See golden bangles on an arm, well-burnished by the goldsmith’s art, clash together, the two of them, fare singly as the rhino’s horn		48	
15	1.3 KHAGGAVISĀṆA Rhinoceros horn Teaching for the Hermit-minded	“Evaṁ dutīyena sahā mamassa, Variant: dutīyena → dutiyena (sabbattha) Vācābhilāpo abhisajjanā vā; Etaṁ bhayaṁ āyatiṁ pekkhamāno, Eko care khaggavisāṇakappo	Thinking, “So too, if I had a partner, there’d be flattery or curses.”  Seeing this peril in the future, live alone like a rhino’s horn.	Thus if I had a partner, I would incur [fond] words of address or verbal friction. Looking out for this peril in the future, one should live alone like a rhinoceros horn.		[Thinking:] “In the same way, if I were to live with another, there would be conversation or attachment.” Seeing this future danger, wander alone like a rhinoceros.	When there’s for me “a second one” with intimate talk and curses both, seeing this fear in future time, fare singly as the rhino’s horn		49	
16	1.3 KHAGGAVISĀṆA Rhinoceros horn Teaching for the Hermit-minded	Kāmā hi citrā madhurā manoramā, Virūparūpena mathenti cittaṁ; Ādīnavaṁ kāmaguṇesu disvā, Eko care khaggavisāṇakappo	Sensual pleasures are diverse, sweet, delightful, appearing in disguise they disturb the mind. Seeing danger in the many kinds of sensual stimulation, live alone like a rhino’s horn.	Sensual pleasures are colorful, sweet, delightful, but in their diversity they agitate the mind. Having seen danger in the strands of sensual pleasure, one should live alone like a rhinoceros horn.		Because sensual pleasures, elegant, honeyed, &charming, bewitch the mind with their manifold forms— seeing this drawback in sensual strings5— wander alone like a rhinoceros.	Sense-things so sweet, so varied, in diverse forms disturb the mind; seeing the bane of sense desires fare singly as the rhino’s horn		50	
17	1.3 KHAGGAVISĀṆA Rhinoceros horn Teaching for the Hermit-minded	“Ītī ca gaṇḍo ca upaddavo ca, Rogo ca sallañca bhayañca metaṁ; Etaṁ bhayaṁ kāmaguṇesu disvā, Eko care khaggavisāṇakappo	This is a calamity, a boil, a disaster, an illness, a dart, and a danger for me. Seeing this peril in sensuality, live alone like a rhino’s horn.	“This is adversity, a boil, disaster, an illness, a dart, and peril for me”: having seen this peril in the strands of sensual pleasure, one should live alone like a rhinoceros horn.		“Calamity, tumor, misfortune, disease, an arrow, a danger for me.” Seeing this danger in sensual strings, wander alone like a rhinoceros.	They are a plague, a blain, distress, disease, a dart and danger too: seeing this fear in sense-desires fare singly as the rhino’s horn		51	
18	1.3 KHAGGAVISĀṆA Rhinoceros horn Teaching for the Hermit-minded	Sītañca uṇhañca khudaṁ pipāsaṁ, Vātātape ḍaṁsasarīsape ca; Variant: ḍaṁsasarīsape → ḍaṁsasiriṁsape (bj, sya-all, km, pts-vp-pli1) Sabbānipetāni abhisambhavitvā, Variant: abhisambhavitvā → abhibbhavitvā (tha-ap2:27 [Paccekabuddhaapadāna]) Eko care khaggavisāṇakappo	Heat and cold, hunger and thirst, wind and sun, flies and snakes: having put up with all these things, live alone like a rhino’s horn.	Cold and heat, hunger, thirst, wind, the hot sun, gadflies, and serpents: having patiently endured all these, one should live alone like a rhinoceros horn.		Cold &heat, hunger &thirst, wind &sun, horseflies &snakes: Enduring all these, without exception, wander alone like a rhinoceros.	The heat and cold, and hunger, thirst, wind, sun, mosquitoes’ bites and snakes’; enduring one and all of these, fare singly as the rhino’s horn		52	
19	1.3 KHAGGAVISĀṆA Rhinoceros horn Teaching for the Hermit-minded	Nāgova yūthāni vivajjayitvā, Sañjātakhandho padumī uḷāro; Yathābhirantaṁ viharaṁ araññe, Variant: viharaṁ → vihare (bj, pts-vp-pli1) Eko care khaggavisāṇakappo”	As a full-grown elephant, lotus-eating, magnificent, forsaking the herd,  stays where it wants in the forest, live alone like a rhino’s horn.	As an elephant that has abandoned the herd — with massive back, lotus-like, eminent — may live in the forest as he pleases, one should live alone like a rhinoceros horn.		As a great white elephant, with massive shoulders, renouncing his herd, lives in the wilds wherever he wants, wander alone like a rhinoceros.	As elephant bull of noble mien, full-grown, the flock forsakes and lives in forests as it pleases him, fare singly as the rhino’s horn		53	
20	1.3 KHAGGAVISĀṆA Rhinoceros horn Teaching for the Hermit-minded	Aṭṭhānataṁ saṅgaṇikāratassa, Yaṁ phassaye sāmayikaṁ vimuttiṁ; Variant: phassaye → phussaye (sya-all) Ādiccabandhussa vaco nisamma, Eko care khaggavisāṇakappo”.	It’s impossible for one who delights in company to experience even temporary freedom. Heeding the speech of the Kinsman of the Sun, live alone like a rhino’s horn.	It is impossible that one who delights in company might attain even temporary liberation. Having attended to the word of the Kinsman of the Sun, one should live alone like a rhinoceros horn.		“There’s no way that one delighting in company can touch even momentary release.”6 Heeding the words of the Kinsman of the Sun,7 wander alone like a rhinoceros.	“Who loves to live in company e’en timely freedom cannot find”; so Kinsman of the Sun declared— fare singly as the rhino’s horn		54	This is apparently the same thing as the occasional release/liberation mentioned in MN 29.
21	1.3 KHAGGAVISĀṆA Rhinoceros horn Teaching for the Hermit-minded	Diṭṭhīvisūkāni upātivatto, Patto niyāmaṁ paṭiladdhamaggo; Uppannañāṇomhi anaññaneyyo, Eko care khaggavisāṇakappo”.	Thinking, “I am one who has left warped views behind, has reached the sure way, has gained the path, has given rise to knowledge, and needs no-one to guide me”, live alone like a rhino’s horn.	“I have transcended the contortions of views, reached the fixed course, obtained the path. I have aroused knowledge, I’m not to be led by others”: one should live alone like a rhinoceros horn.		Transcending the contortion of views,8 the sure way attained, the path gained, [realizing:] “Unled by others, I have knowledge arisen,” wander alone like a rhinoceros.	View-contortions gone beyond, right method won, the path attained, “I Know! No other is my guide!” fare singly as the rhino’s horn.		55	
22	1.3 KHAGGAVISĀṆA Rhinoceros horn Teaching for the Hermit-minded	Nillolupo nikkuho nippipāso, Nimmakkho niddhantakasāvamoho; Nirāsayo sabbaloke bhavitvā, Variant: Nirāsayo → nirāsāso (mr) Eko care khaggavisāṇakappo”	No greed, no guile, no thirst, no slur, dross and delusion is smelted off;  free of hoping for anything in the world, live alone like a rhino’s horn.	Without greed, without scheming, without thirst, not denigrating, with stains and delusion blown away, without wishes for anything in all the world, one should live alone like a rhinoceros horn.		With no greed, no deceit, no thirst, no hypocrisy— delusion &blemishes blown away— with no inclinations for all the world, every world, wander alone like a rhinoceros.	No greed, no guile, no thirst, no slur, and blown away by delusion’s fault; wantless in all the world’s become, fare singly as the rhino’s horn		56	smelting of gold, AN 3.101
23	1.3 KHAGGAVISĀṆA Rhinoceros horn Teaching for the Hermit-minded	Pāpaṁ sahāyaṁ parivajjayetha, Anatthadassiṁ visame niviṭṭhaṁ; Sayaṁ na seve pasutaṁ pamattaṁ, Eko care khaggavisāṇakappo	Avoid a wicked companion, blind to the good, habitually immoral. One ought not befriend the heedless and hankering, but live alone like a rhino’s horn.	One should avoid an evil companion, who shows what is harmful, one settled in unrighteousness. One should not freely associate with one who is intent and heedless; one should live alone like a rhinoceros horn.		Avoid the evil companion disregarding the goal, intent on the discordant9 way. Don’t associate yourself with someone heedless &hankering. Wander alone like a rhinoceros.	Shun the evil friend who sees no goal, convinced in crooked ways, serve not at will the wanton one, fare singly as the rhino’s horn		57	
24	1.3 KHAGGAVISĀṆA Rhinoceros horn Teaching for the Hermit-minded	Bahussutaṁ dhammadharaṁ bhajetha, Mittaṁ uḷāraṁ paṭibhānavantaṁ; Aññāya atthāni vineyya kaṅkhaṁ, Eko care khaggavisāṇakappo”	Spend time with a learned expert who has memorized the teachings, an eloquent and uplifting friend. When you understand the meanings and have dispelled doubt, live alone like a rhino’s horn.	One should resort to the learned, a bearer of Dhamma, an eminent friend gifted with ingenuity. Having known the benefits and removed doubt, one should live alone like a rhinoceros horn.		Consort with one who is learned, who maintains the Dhamma, a great &quick-witted friend. Knowing the meanings, subdue your perplexity, [then] wander alone like a rhinoceros.	Follow that friend who’s deeply-learned, Dharma-endowed and lucid, great, knows meaning leading out of doubts, fare singly as the rhino’s horn		58	
25	1.3 KHAGGAVISĀṆA Rhinoceros horn Teaching for the Hermit-minded	Khiḍḍaṁ ratiṁ kāmasukhañca loke, Analaṅkaritvā anapekkhamāno; Vibhūsanaṭṭhānā virato saccavādī, Variant: Vibhūsanaṭṭhānā → vibhūsaṭṭhānā (…) Eko care khaggavisāṇakappo	When you realize that worldly fun and games and pleasure are unsatisfying, disregarding them, as one unadorned, a speaker of truth, live alone like a rhino’s horn	Having found no satisfaction in the world with play, delight, and sensual pleasures, not taking any interest in them, refraining from ornaments, a speaker of truth, one should live alone like a rhinoceros horn.		Free from longing, finding no pleasure in the world’s sport, ardor, or sensual bliss, abstaining from adornment, speaking the truth, wander alone like a rhinoceros.	In playful love and sensual joys find no reward—no longer long; embellish not but speak the truth, fare singly as the rhino’s horn.		59	
