9	4.10 PURĀBEDHA Before Breaking-up”: a Muni’s Qualities	yassa nissayatā natthi ñatvā dhammaṃ anissito bhavāya vibhavāya vā taṇhā yassa na vijjati	They have no dependencies, understanding the teaching, they are independent. No craving is found in them to continue existence or to end it.	“He has no dependencies — having known the Dhamma, he is independent. No craving is found in him for existence or nonexistence.	He for whom there is nothing to depend upon, having known the nature of things independently, and for whom neither for being nor for unbeing there is found any craving-	Whose dependencies don’t exist when, on knowing the Dhamma, he’s independent; in whom no craving is found for becoming or not-:	And for whom there’s no “dependence”,⁸ not dependent, Dharma having known, for such exists no craving for existence, non-existence.		856	
10	4.10 PURĀBEDHA Before Breaking-up”: a Muni’s Qualities	taṃ brūmi upasantoti kāmesu anapekkhinaṃ ganthā tassa na vijjanti atarī so visattikaṃ	I declare them to be at peace, unconcerned for sensual pleasures. No ties are found in them, they have crossed over clinging.	“I call him ‘peaceful’ who is indifferent to sensual pleasures. In him no knots are found; he has crossed over attachment.	him I call the peaceful one, the one without concern for sensual pleasures. For him there are no knots, for he has crossed the viscosity.	He is said to be at peace, un-intent on sensual pleasures, with nothing at all to tie him down: one who’s crossed over attachment.	That one I call the Peaceful, who no sensual pleasures seeks; who therefore has no ties, crossed entanglement.		857	
11	4.10 PURĀBEDHA Before Breaking-up”: a Muni’s Qualities	na tassa puttā pasavo khettaṃ vatthuñca vijjati attaṃ vāpi nirattaṃ vā na tasmiṃ upalabbhati	They have no sons or cattle, nor possess fields or lands. No picking up or putting down  is to be found in them.	“He has no sons or cattle, nor does he possess fields or land.  In him there is nothing to be found as either taken up or rejected.	For him neither sons nor cattle nor fields and land are to be found. The assumed and the rejected also these are not to be found in him.	He has no children cattle, fields, land. In him you can’t pin down what’s embraced or rejected.	He does not bring up any sons, and has no fields or lands; for him there is nothing at all that is taken up or put down		858	As in Snp 4.3:8.3 this makes better sense considered as an active process.
12	4.10 PURĀBEDHA Before Breaking-up”: a Muni’s Qualities	yena naṃ vajjuṃ puthujjanā atho samaṇabrāhmaṇā taṃ tassa apurakkhataṃ tasmā vādesu nejati	That by which one might describe an ordinary person or ascetics and brahmins has no importance to them, which is why they’re unaffected by words.	“That by which they might speak of him — worldlings as well as ascetics and brahmins — is not esteemed by him; therefore he is not stirred up by words.	That by which they might tell him, the common people or else the recluses and brahmins, that is not paid attention8  to by him.  Therefore he is not shaken by what they say.	He has no preference for that which people run-of-the-mill or brahmans &contemplatives might blame— which is why he is unperturbed with regard to their words.	on account of which, the people with monks and Brahmins might accuse. That one is undisturbed, and by such words unmoved,		859	
13	4.10 PURĀBEDHA Before Breaking-up”: a Muni’s Qualities	vītagedho amaccharī na ussesu vadate muni na samesu na omesu kappaṃ neti akappiyo	Freed of greed, not stingy, a sage doesn’t speak of themselves as being among superiors, inferiors, or equals. One not prone to creation does not return to creation.	“Devoid of greed, without miserliness, the muni does not speak [of himself] as among superiors, or equals, or inferiors. Not given to mental construction, he does not enter upon mental constructs.	Being free of greed and avarice the Muni does not speak of himself in terms of superiority, equality or inferiority, he does not enter into what can be classed, he is not classifiable.	His greed gone, not miserly, the sage doesn’t speak of himself as among those who are higher, equal, or lower. He, theory-free, goes to no theory.	gone greediness and never mean, not speaking of themselves as “high” not “equal”, nor “inferior” so the unfittable does not fit,		860	
14	4.10 PURĀBEDHA Before Breaking-up”: a Muni’s Qualities	yassa loke sakaṃ natthi asatā ca na socati dhammesu ca na gacchati sa ve santoti vuccatīti	They who have nothing in the world of their own do not grieve for that which is not, or drift among the teachings;  that’s who is said to be at peace.”	“One who takes nothing in the world as his own, and who does not sorrow over what is absent, who does not enter upon things: he is truly said to be ‘peaceful.’ ”	He for whom nothing in the world is his own and who does not grieve at the absence and does not go around in ideas— he is truly said to be “at peace”.	For whom nothing in the world is his own, who doesn’t grieve over what is not, who doesn’t enter into doctrines: He is said to be at peace.”	for whom is nothing owned in the world and having nothing does not grieve, who ’mong Dharmas ventures not is truly called a Peaceful One!		861	Given the significance of “views” in the Aṭṭhakavagga, and that dhamma is commonly used in the sense of “teaching”, I read this in view of such passages as MN 47:14.3: dhammesu niṭṭhaṁ gacchati “comes to a conclusion about the teachings”.
1	4.14 Tuvaṭaka Quick Way	pucchāmi taṃ ādiccabandhu vivekaṃ santipadañca mahesi kathaṃ disvā nibbāti bhikkhu anupādiyāno lokasmiṃ kiñci	“Great hermit, I ask you, the Kinsman of the Sun, about seclusion and the state of peace. How, having seen, is a mendicant quenched, not grasping anything in this world?”	“I ask you, Kinsman of the Sun, great rishi, about seclusion and the state of peace. How having seen does a bhikkhu attain nibbāna, not clinging to anything in the world?”	I ask you, O Kinsman of the Sun, about seclusion and the state of peace, O Sage. How having seen is a monk quenched, not taking up anything in the world.	“I ask the Kinsman of the Sun, the Great Seer, about seclusion &the state of peace. Seeing in what way is a monk unbound, clinging to nothing in the world?”	I ask the Kinsman of the Sun, the great seeker, About seclusion and the state of peace. Seeing what is a bhikkhu quenched, Not grasping at anything in the world?		915	See also: DN 2, MN 18, SN 23.2
2	4.14 Tuvaṭaka Quick Way	mūlaṃ papañcasaṅkhāya (iti bhagavā) mantā asmīti sabbamuparundhe yā kāci taṇhā ajjhattaṃ tāsaṃ vinayā sadā sato sikkhe	“They would cut off the idea, ‘I am the thinker,” said the Buddha, “which is the root of all concepts of identity due to proliferation.  Ever mindful, they would train to remove any internal cravings.	“By reflection, he should stop [the conceit] ‘I am,’ the entire root of concepts due to proliferation,” [the Blessed One said]. “Whatever cravings there may be internally, he should always train mindfully for their removal.	The root of expanse-and-name,18 the “I am”, the deep thinker should put a complete end to. Whatever cravings are within, for dispelling these, he should always train mindfully	“He should put an entire stop to the root of objectification-classifications: ‘I am the thinker.’1 He should train, always mindful, to subdue any craving inside him.	One should completely extract The root of proliferation and reckoning— The notion, “I am the thinker”. One should train to dispel whatever craving There is inside, ever mindful.		916	14 pali = 13 Chinese  Chinese story is difierent
3	4.14 Tuvaṭaka Quick Way	yaṃ kiñci dhammamabhijaññā ajjhattaṃ atha vāpi bahiddhā na tena thāmaṃ kubbetha na hi sā nibbuti sataṃ vuttā	Regardless of what things they know, whether internal or external, they wouldn’t be proud because of that, for that is not extinguishment, say the good.	“Whatever one might know, whether internally or externally, one should not be obstinate on that account, for that is not called quenching by the good.	Whatever thing he would directly know, whether in himself or outside, that he should not build up ‘strength’ upon, for that is not called quenching by the good.	Whatever truth he may know, within or without, he shouldn’t, because of it, make himself hardened, for that isn’t called unbinding by the good.	Whatever principle they have known for themselves, Whether internally or externally, They would not be stubborn about that, For good people say that this is not quenching.		917	
4	4.14 Tuvaṭaka Quick Way	seyyo na tena maññeyya nīceyyo athavāpi sarikkho phuṭṭho anekarūpehi nātumānaṃ vikappayaṃ tiṭṭhe	They wouldn’t let that make them conceited, thinking themselves better or worse or alike. When questioned in many ways,  they wouldn’t keep justifying themselves.	“Because of this one should not think oneself better, nor should one consider oneself inferior or equal. Being affected in various ways, one should not persist in positioning oneself.	By that he should not think himself to be better, or to be lower or equal. Contacted by many forms he should not stay making out himself.	He shouldn’t, because of it, think himself better, lower, or equal. Touched by contact in various ways, he shouldn’t keep theorizing about self.	You shouldn’t, on that account, think you are better, Or worse, or even the same; Though affected by many different things, You should not keep thinking of yourself.		918	
5	4.14 Tuvaṭaka Quick Way	ajjhattamevupasame na aññato bhikkhu santimeseyya ajjhattaṃ upasantassa natthi attāṃ kuto nirattāṃ vā	A mendicant would find peace inside themselves, and not seek peace from another. For one at peace inside themselves, there’s no picking up, whence putting down?	“It is internally that he should achieve peace; a bhikkhu should not seek peace through another. For one who is at peace within himself, there is nothing taken up, much less rejected.	Only in himself should he come to peace, a monk should not seek peace from what is other. For the one come to peace in himself there is not the assumed, from where the rejected.	Stilled right within, a monk shouldn’t seek peace from another, from anything else. For one stilled right within, there’s nothing embraced, so how rejected?	Totally calm within himself, A bhikkhu would not seek peace from another; For one who is at peace with themselves, There is nothing to hold on to, still less to put down.		919	
6	4.14 Tuvaṭaka Quick Way	majjhe yathā samuddassa ūmi no jāyatī ṭhito hoti evaṃ ṭhito anejassa ussadaṃ bhikkhu na kareyya kuhiñci	Just as, in the mid-ocean deeps  no waves arise, it stays still; so too one unstirred is still a mendicant would nurse no pride at all.”	“Just as in the middle of the ocean no wave arises, but the ocean remains steady, so too he should be steady, without impulse; a bhikkhu should not cause a swelling anywhere.”	As in the middle of the ocean no wave is born, it stays still. So he should stay still without movement and allow no ‘up-flow’ anywhere.	As in the middle of the sea it is still, with no waves upwelling, so the monk—unperturbed, still— should not swell himself anywhere.”	As in the middle of the ocean, There are no waves, but all is still, So they would be still, unmoving; A bhikkhu is not haughty at all.		920	
7	4.14 Tuvaṭaka Quick Way	akittayī vivaṭacakkhu sakkhidhammaṃ parissayavinayaṃ paṭipadaṃ vadehi bhaddante pātimokkhaṃ atha vāpi samādhiṃ	“He whose eyes are open has explained the truth he witnessed, where adversities are removed. Please now speak of the practice, sir, the monastic code and immersion in samādhi.	“The one with opened eyes declared the Dhamma he witnessed, the removal of obstacles. Speak about the practice, venerable one, the Pātimokkha and also concentration.”	The open-eyed one has declared the nature of things as experienced, putting aside difficulties.20 Tell us of the practice, Venerable Sir, the binding principles, as well as composure.	“He whose eyes are open has described the Dhamma he’s witnessed, subduing danger. Now tell us, sir, the practice: the Pāṭimokkha &concentration.”	You have taught me, with your eyes open, Seeing principles for yourself, dispelling dangers; Venerable sir, tell me the practice, The rules of conduct and also meditation.		921	
8	4.14 Tuvaṭaka Quick Way	cakkhūhi neva lolassa gāmakathāya āvaraye sotaṃ rase ca nānugijjheyya na ca mamāyetha kiñci lokasmiṃ	“With eyes not wanton, they’d turn their ears from village gossip. They wouldn’t be greedy for flavors, nor possessive about anything in the world.	“One should not be restless with the eyes, one should block the ears against village gossip. One should not be greedy for tastes, and one should not take anything in the world as ‘mine.’	He should not be restless with his eyes. He should close his ears to village talk. He should not be greedy for tastes and not make ‘mine’ anything in the world.	“One shouldn’t be careless with his eyes, should close his ears to village-talk, shouldn’t hunger for flavors, or view anything in the world as mine.	Not letting their eyes wander, Turning their ear from crass conversations, Not greedy for flavors, And not thinking of anything in the world as “mine”.		922	
9	4.14 Tuvaṭaka Quick Way	phassena yadā phuṭṭhassa paridevaṃ bhikkhu na kareyya kuhiñci bhavañca nābhijappeyya bheravesu ca na sampavedheyya	Though struck by contacts, a mendicant would not lament at all. They wouldn’t pray for another life, nor tremble in the face of dangers.	“When he is touched by a contact, a bhikkhu should not lament anywhere. He should not long for any state of existence, nor should he tremble amid fearful conditions.	When contacted by contact a monk should not make lamentation about anything. He should not hanker after existence, and not shake among fearful things.	When touched by contact, he shouldn’t lament, shouldn’t covet anywhere any states of becoming, or tremble at terrors.	When things afflict him, A bhikkhu would not whinge at all; He would neither long for rebirth, Nor tremble at dangers.		923	
10	4.14 Tuvaṭaka Quick Way	annānamatho pānānaṃ khādanīyānaṃ athopi vatthānaṃ laddhā na sannidhiṃ kayirā na ca parittase tāni alabhamāno	When they receive food and drink, edibles and clothes, they wouldn’t store them up, nor worry about not getting them.	“Having obtained food and drink, things to eat or clothes to wear, he should not hoard them, nor be agitated if he does not obtain them.	Of foods and drinks of chewables as well as of clothes he should not, if getting them, make a store, and he should not become anxious if not getting them.	When gaining food &drink, staples &cloth, he should not make a hoard. Nor should he be upset when receiving no gains.	He would not store up goods that he gets, Whether food and drink, Other edibles or cloth, And he would not be afraid of not getting anything.		924	
11	4.14 Tuvaṭaka Quick Way	jhāyī na pādalolassa virame kukkuccā nappamajjeyya athāsanesu sayanesu appasaddesu bhikkhu vihareyya	Meditative, not footloose, they’d avoid remorse and not be negligent. Then a mendicant would stay in quiet places to sit and rest.	“He should be a meditator, not one with restless feet; he should refrain from regret; he should not be heedless. A bhikkhu should dwell amid seats and beds [in lodgings] where there is little noise.	He should be meditative and not restless on his feet. He should refrain from loose conduct and not be negligent. Then in sitting and resting places that are of little sound a monk should dwell.	Doing jhāna, not footloose, he should refrain from restlessness, shouldn’t be heedless, should live in a noise-less abode.	Practising jhāna, not footloose, Not remorseful, nor negligent; That bhikkhu would stay in quiet Places for meditation and sleep.		925	
12	4.14 Tuvaṭaka Quick Way	niddaṃ na bahulīkareyya jāgariyaṃ bhajeyya ātāpī tandiṃ māyaṃ hassaṃ khiḍḍaṃ methunaṃ vippajahe savibhūsaṃ	They wouldn’t take much sleep, but, being keen, would apply themselves to wakefulness. They’d give up sloth, illusion, mirth, and play, and sex and ornamentation.	“He should not overindulge in sleep; he should be devoted to wakefulness, ardent. He should abandon indolence, hypocrisy, laughing, and playfulness, sexual intercourse, and personal ornamentation.	He should not take much sleep, but should apply himself to wakefulness, being ardent. Lassitude, deceit, laughter and play he should dispel, as well as sexuality and adornment.	ardent, given to wakefulness, he should abandon weariness, deception, laughter, sports, sexual intercourse, &all that goes with it;	They would not sleep much, But be ardent, developing wakefulness; They would abandon laziness, deceit, jokes, games, And sex, together with other frivolities.		926	
13	4.14 Tuvaṭaka Quick Way	āthabbaṇaṃ supinaṃ lakkhaṇaṃ no vidahe athopi nakkhattaṃ virutañca gabbhakaraṇaṃ tikicchaṃ māmako na seveyya	They wouldn’t cast Artharvaṇa spells, interpret dreams or omens, or practice astrology. My followers would not decipher animal cries, practice healing, or cast pregnancy spells.	“He should not employ Atharva spells, or interpret dreams, signs, or constellations.   My follower would not decipher animal cries, or practice healing or making women fertile.	Atharva charms, dreams and signs he should not practice, as well as astrology. Animal cries interpretation, causing of conception, and healing my follower should not engage it.	should not practice casting spells,3 interpret dreams, physical marks, the stars, animal cries; should not be devoted to doing cures or inducing fertility.	One of my followers would not cast spells, Or interpret dreams, Nor would they practice astrology, Prognosticate animal sounds, Practice fertility magic, Or [earn money] as a healer.		927	
14	4.14 Tuvaṭaka Quick Way	nindāya nappavedheyya na uṇṇameyya pasaṃsito bhikkhu lobhaṃ saha macchariyena kodhaṃ pesuṇiyañca panudeyya	Not shaken by criticism, a mendicant would not pride themselves when praised. They’d reject greed and stinginess, anger, and slander.	“A bhikkhu should not be shaken by blame, nor should he be elated when praised. He should dispel greed and miserliness, as well as anger and slanderous speech.	A monk should not tremble at blame, and not get elated when praised. Greed together with avarice, anger and slander he should dispel.	A monk shouldn’t tremble at blame or grow haughty with praise; should dispel stinginess, greed, divisive speech, anger;	A bhikkhu would not be anxious when criticized, Nor puffed up when praised; But would get rid of greed together with Stinginess, anger, and slander		928	
15	4.14 Tuvaṭaka Quick Way	kayavikkaye na tiṭṭheyya upavādaṃ bhikkhu na kareyya kuhiñci gāme ca nābhisajjeyya lābhakamyā janaṃ na lapayeyya	They’d not stand for buying and selling; a mendicant would not speak ill at all. They wouldn’t linger in the village, nor cajole people from desire for profit.	“A bhikkhu should not engage in buying and selling; he should not do anything that incurs criticism. He should not form intimacy in the village; he should not address people from a desire for gain.	A monk should not stay with buying and selling, and not make criticism regarding anything. He should not get attached in the village and not speak boastfully out of a desire for gain.	shouldn’t buy or sell or revile anyone anywhere; shouldn’t linger in villages, or flatter people in hope of gains.	They would not continue at a trade, A bhikkhu would not incur blame at all; They would not linger in a village, Nor cajole people hoping to get stuff.		929	
16	4.14 Tuvaṭaka Quick Way	na ca katthitā siyā bhikkhu na ca vācaṃ payuttaṃ bhāseyya pāgabbhiyaṃ na sikkheyya kathaṃ viggāhikaṃ na kathayeyya	A mendicant would be no boaster, nor would they speak suggestively. They wouldn’t train in impudence, nor speak argumentatively.	“A bhikkhu should not be boastful, and he should not utter insinuating speech. He should not train himself in impudence; he should not utter contentious talk.	A monk should not be a boaster and not speak hintingly. He should not train in recklessness and not speak quarrelsome speech.	A monk shouldn’t boast or speak with ulterior motive, shouldn’t train in insolence or speak quarrelsome words;	A bhikkhu would not be boastful, Nor speak with an ulterior motive; He would not practice impudence, Nor say things that were argumentative.		930	
17	4.14 Tuvaṭaka Quick Way	mosavajje na nīyetha sampajāno saṭhāni na kayirā atha jīvitena paññāya sīlabbatena nāññamatimaññe	They wouldn’t be led into lying, nor be deliberately devious. And they’d never look down on another because of livelihood, wisdom, or precepts and vows.	“He should not be led into false speech, nor should he deliberately do anything deceptive.  Because of his way of life, his wisdom, or his good behavior and observances, he should not despise another.	He should not be led by falsehood and in awareness he should not act in a deceitful manner. Then on account of life and wisdom and virtue and practice he should not despise another.	shouldn’t engage in lies or knowingly cheat; shouldn’t despise others for their life, discernment, habits, or practices.	He would not be carried away by lies, Nor deliberately betray anyone; Nor would he look down on anyone for their Way of life, intelligence, virtue, or vows.		931	
18	4.14 Tuvaṭaka Quick Way	sutvā rusito bahuṃ vācaṃ samaṇānaṃ vā puthujanānaṃ pharusena ne na paṭivajjā na hi santo paṭisenikaronti	Though provoked from hearing much talk from ascetics saying all different things,  they wouldn’t react harshly, for the virtuous do not retaliate	“When provoked, having heard many words from ascetics who speak profusely, he should not respond to them harshly, for the good do not retaliate.	Provoked after hearing much talk, from recluses as well as from common people, he should not counter them with harsh speech, for the good do not retaliate.	Annoyed on hearing many words from contemplatives or ordinary people, he shouldn’t respond harshly, for those who retaliate aren’t calm.	Even if provoked by different sayings, Of ascetics or of ordinary people, He would not answer harshly, For good people make no enemies.		932	
19	4.14 Tuvaṭaka Quick Way	etañca dhammamaññāya vicinaṃ bhikkhu sadā sato sikkhe santīti nibbutiṃ ñatvā sāsane gotamassa na pamajjeyya	Having understood this teaching, inquiring, a mendicant would always train mindfully. Knowing extinguishment as peace, they’d not be negligent in Gotama’s bidding.	“Having understood this Dhamma, investigating, a bhikkhu should always train mindfully. Having known quenching as peace, he should not be heedless in Gotama’s teaching.	Knowing that this is the Dhamma, reflecting on it a monk should always train mindfully. Knowing quenching to be “peace” he should not be negligent in Gotama’s teaching	monk inquiring should always train in it mindfully. Knowing unbinding as peace, he shouldn’t be heedless of Gotama’s message—	Fully understanding this principle, An inquiring bhikkhu would always train mindfully; Knowing quenching as peace, He would not be negligent in Gotama’s teaching.		933	
20	4.14 Tuvaṭaka Quick Way	abhibhū hi so anabhibhūto sakkhidhammamanītihamadassī tasmā hi tassa bhagavato sāsane appamatto sadā namassamanusikkheti	For he is the undefeated, the champion, seer of the truth as witness, not by hearsay— that’s why, being diligent, they would always respectfully train in the Buddha’s teaching.”	“For he is a conqueror who is himself unconquered; he saw the Dhamma as a witness, not by hearsay. Therefore, heedful in that Blessed One’s teaching, always honoring it, one should train in accordance with it.”	For he is the overcomer who is not overcome. With his own eyes he saw the Dhamma not based on hear-say. Therefore in the teaching of that Blessed one one should always train with diligence and devotion.	for he, the Conqueror unconquered, witnessed the Dhamma, not by hearsay, but directly, himself. So, heedful, you should always do homage &train in line with that Blessed One’s message,” the Blessed One said.	He overcomes, he is not overcome, Seeing the Dhamma with his own eyes, not by hearsay; Therefore he would always respectfully train in accord, Diligent in the teaching of the Buddha.		934	
1	4.15  ATTADAṆḌA Taking weapons 	attadaṇḍā bhayaṃ jātaṃ janaṃ passatha medhagaṃ saṃvegaṃ kittayissāmi yathā saṃvijitaṃ mayā	Peril stems from those who take up arms— just look at people in conflict! I shall extol how I came to be stirred with a sense of urgency.	“Fear has arisen from one who has taken up the rod: see the people engaged in strife. I will tell you of my sense of urgency, how I was stirred by a sense of urgency.	From the taking up of sticks fear arises— look at people quarrelling. I shall describe the sense of urgency in the way it was experienced by me.	“When embraced, the rod of violence1 breeds danger &fear: Look at people in strife. I will tell how I experienced terror:	Fear’s born assuming forcefulness¹⁶— see how the people fight! I’ll tell you how I’m deeply moved, how I have felt so stirred.		935	
