7	4.6   JARA Old age	patilīnacarassa bhikkhuno bhajamānassa vivittamāsanaṁ sāmaggiyamāhu tassa taṁ yo attānaṁ bhavane na dassaye	For a mendicant who lives withdrawn, frequenting a secluded seat, they say it’s fitting to not show themselves in a home.	When a bhikkhu lives withdrawn, resorting to a secluded seat, they say it is appropriate for him not to show himself in a fixed dwelling.	Of the monk who fares withdrawn and resorts to a secluded seat they say it agrees with his heart not to show himself in an abode.	A monk, living withdrawn, enjoying a dwelling secluded: They say it’s congenial for him, he who wouldn’t, in any realm, display self.	For a bhikkhu practicing in solitude, keeping company with secluded mind, of such a one are all agreed: “In being he’ll not be seen again”.	A monk, living withdrawn, enjoying a dwelling secluded: They say it is fitting of him That he would not manifest self in any settled abiding	810	
8	4.6   JARA Old age	sabbattha munī anissito na piyaṁ kubbati nopi appiyaṁ tasmiṁ paridevamaccharaṁ paṇṇe vāri yathā na limpati	The sage is independent everywhere, they don’t form likes or dislikes. Lamentation and stinginess slip off them like water from a leaf.	The muni is not dependent on anything; he takes nothing as pleasing, nothing as displeasing. Lamentation and miserliness do not stick to him as water does not stick to a leaf.	Everywhere the Muni is independent and does not regard things as liked or disliked. On him lamentation and avarice do not stick as water does not on a lotus leaf.	Everywhere the sage independent makes nothing dear or undear. In him lamentation &selfishness, like water on a white lotus, do not adhere.	In all matters the sage is unsupported, nothing that makes dear, nor undear, sorrow and avarice do not stain that one, As water does not stay upon a leaf.	The sage is independent everywhere, they don’t form likes or dislikes. Lamentation and fear of loss do not adhere, Like water on a leaf.	811	
9	4.6   JARA Old age	udabindu yathāpi pokkhare padume vāri yathā na limpati evaṁ muni nopalippati yadidaṁ diṭṭhasutaṁ mutesu vā	Like a droplet slips from a lotus-leaf, like water from a lotus flower; the sage doesn’t cling to that which is seen or heard or thought.	Just as a water drop does not stick to a lotus leaf, or water to the lotus flower, so the muni does not cling to anything among the seen, heard, or sensed.	As a water drop on a lotus leaf does not stick or as water on a lotus flower, so the Muni does not get stuck in whatever is seen, heard, or thought.	As a water bead on a lotus leaf, as water on a red lily, doesn’t adhere, so the sage doesn’t adhere to the seen, the heard, or the sensed;	As a water-drop on lotus plant, as water does not stain a lotus flower, even so the sage is never stained by seen, heard, or whatever’s cognized.	As a water drop on a lotus leaf, as water on a red lily, doesn’t adhere, so the sage doesn’t adhere to the seen, the heard, or the sensed;	812	v 812 and 813 are inverted in Chinese 
10	4.6   JARA Old age	dhono na hi tena maññati yadidaṁ diṭṭhasutaṁ mutesu vā nāññena visuddhimicchati na hi so rajjati no virajjatīti	For the one who is cleansed does not conceive in terms of things seen, heard, or thought. They do not wish to be purified by another; they are neither passionate nor growing dispassioned.	One cleansed does not thereby conceive things seen, heard, or sensed. He does not wish for purification by another, for he becomes neither passionate nor dispassionate.	The cleansed one does not conceive of a ‘that-by-which’ in regard to anything seen, heard, or thought. He does not aspire to purity through what is other. Neither does he get attached nor does he [strive] to get detached.	for, cleansed, he doesn’t suppose in connection with the seen, the heard, or the sensed. In no other way does he wish for purity, for he neither takes on passion nor puts it away.	Certainly the wise do not conceive upon the seen, the heard, and cognized, nor wish for purity through another, for they are not attached nor yet displeased.	Thus the purified man does not imagine anything Regarding what is seen, heard, or felt. He does not want purity through what is extraneous; Indeed, he is neither passionate nor impassive.	813	
1	4.7  TISSAMETTEYYA Disadvantages of Sex	methunamanuyuttassa (iccāyasmā tisso metteyyo) vighātaṃ brūhi mārisa sutvāna tava sāsanaṃ viveke sikkhissāmase	“When someone indulges in sex,” said Venerable Tissametteyya, “tell us, sir: what trouble befalls them? After hearing your instruction, we shall train in seclusion.”	“For one who indulges in sexual intercourse,” (said the Venerable Tissa Metteyya), “tell me, dear sir, of the distress. Having heard your teaching, we will train in seclusion.”	If one were to engage in sexual intercourse, tell us, Sir, about the misfortune one gets into. Having heard your teaching we will train in solitude.	Tissa-metteyya: “Tell the damage, dear sir, for one given over to sexual intercourse. Having heard your teaching, we’ll train in seclusion.”	Attached to sexual intercourse: Sir, tell its disadvantages, having heard your Teaching then, secluded we will train ourselves.		814	MN 22; SN 1:20; AN 4:159; AN 5:75–76; AN 7:48; Ud 3:2
2	4.7  TISSAMETTEYYA Disadvantages of Sex	methunamanuyuttassa (metteyyāti bhagavā) mussatevāpi sāsanaṃ micchā ca paṭipajjati etaṃ tasmiṃ anāriyaṃ	“When someone indulges in sex,” replied the Buddha, “they forget their instructions and go the wrong way— that is something ignoble in them.	“When one indulges in sexual intercourse, (Metteyya,” the Blessed One said), “even the teaching itself is forgotten, and he practices wrongly: this is ignoble in him.	The one engages in sexual intercourse forgets about the teachings, and he takes a wrong course— that is an ignoble trait in him.	The Buddha: “In one given over to sexual intercourse, the teaching is muddled and he practices wrongly: This is ignoble in him.	Attached to sexual intercourse, forgetful of the Teaching then, wrong things that person practices, and does what is not Noble.		815	Quite difierent stories. 
3	4.7  TISSAMETTEYYA Disadvantages of Sex	eko pubbe caritvāna methunaṃ yo nisevati yānaṃ bhantaṃva taṃ loke hīnamāhu puthujjanaṃ	Someone who formerly lived alone and then resorts to sex is like a chariot careening off-track; in the world they call them a low, ordinary person.	“One who previously lived alone but then resorts to sexual intercourse is like a vehicle that has gone astray: in the world they call him a low worldling.	The one who first fared alone and then engages in sexual intercourse is like a swaying chariot, as in the world they say, a low ordinary man.	Whoever once went alone, but then resorts to sexual intercourse —like a carriage out of control— is called vile in the world, a person run-of-the-mill.	Who formerly fared on alone but now in sex indulges, “Low” they say’s that common worldly one, like vehicle swerving o ffthe track.		816	
4	4.7  TISSAMETTEYYA Disadvantages of Sex	yaso kitti ca yā pubbe hāyatevāpi tassa sā etampi disvā sikkhetha methunaṃ vippahātave	Their former fame and reputation also fall away. Seeing this, they’d train to give up sex.	“Whatever fame and acclaim he previously enjoyed, these fall away from him. Having seen this, one should train to abandon sexual intercourse.	The reputation and praise he had before that falls away from him. Seeing this too one should train oneself to well abandon sexuality.	His earlier honor &dignity: lost. Seeing this, he should train himself to abandon sexual intercourse.	That one who had renown and fame— that, for sure, diminishes, having seen this, train yourself, renouncing sexual intercourse.		817	
5	4.7  TISSAMETTEYYA Disadvantages of Sex	saṅkappehi pareto so kapaṇo viya jhāyati sutvā paresaṃ nigghosaṃ maṅku hoti tathāvidho	Oppressed by thoughts, they brood like a wretch. When they hear what others are saying, such a person is embarrassed.	“Oppressed by his thoughts, he broods like a poor wretch. Having heard the reprimand of others, one such as this is humiliated.	Overcome by thoughts he broods like a destitute. Hearing what others are saying he becomes worried.	Overcome by resolves, he broods like a miserable wretch. Hearing the scorn of others, he’s chagrined.	Overcome by (lustful) thoughts, that one broods as a beggar does, and hearing reproach of others, then such a person is depressed.		818	
6	4.7  TISSAMETTEYYA Disadvantages of Sex	atha satthāni kurute paravādehi codito esa khvassa mahāgedho mosavajjaṃ pagāhati	Then they lash out with verbal daggers when reproached by others. This is their great blind spot;  they sink to lies.	“Then he prepares weapons [of defense] when reproached by the words of others. This is a great thicket for him, that he sinks into false speech.	Then he starts making weapons [in defence] when blamed by others. And that is his big blunder: he plunges into falsehood.	Hearing the scorn of others, he’s chagrined. He makes weapons, attacked by the words of others. This, for him, is a great entanglement. He sinks into lies.	For yourself creating “arms” of others reprimanding words, so with great entanglement sinks down into untruthfulness.		819	
7	4.7  TISSAMETTEYYA Disadvantages of Sex	paṇḍitoti samaññāto ekacariyaṃ adhiṭṭhito athāpi methune yutto mandova parikissati	They once were considered astute,  committed to the solitary life. But then they indulged in sex, dragged along by desire like an idiot	“He was known as a wise man when resolved on living alone, but when he engaged in sexual intercourse, like a dullard he is afflicted.	Whereas he was considered a wise man while he was devoted to solitude, now that he engages in sexual intercourse he gets pushed around like a fool.	They thought him wise when he committed himself to the life alone, but now that he’s given to sexual intercourse they declare him a dullard.	Well-known as “one who’s wise” when vowing to the single life, but later then engaged in sex will be “a fool defiled”.		820	
8	4.7  TISSAMETTEYYA Disadvantages of Sex	etamādīnavaṃ ñatvā muni pubbāpare idha ekacariyaṃ daḷhaṃ kayirā na nisevetha methunaṃ	Knowing this danger in falling from a former state here,  a sage would firmly resolve to wander alone, and would not resort to sex.	“Having known this danger here in the before and after, a muni should resolutely live alone; he should not resort to sexual intercourse.	Knowing the danger involved in this, initially as well as later, the Muni should make firm his solitary life and not indulge in sexual intercourse.	Knowing these drawbacks, the sage here—before &after— stays firm in the life alone; doesn’t resort to sexual intercourse;	The disadvantage having known, the sage, at start and afterwards, should stablish fast the single life, having no recourse to sex		821	
9	4.7  TISSAMETTEYYA Disadvantages of Sex	vivekaññeva sikkhetha etaṃ ariyānamuttamaṃ na tena seṭṭho maññetha sa ve nibbānasantike	They’d train themselves only in seclusion; this, for the noble ones, is highest. One who wouldn’t conceive themselves “best” due to that— they have truly drawn near to extinguishment.	“One should train just in seclusion; this is supreme among the noble ones. One should not conceive oneself best because of this: then one is indeed close to nibbāna.	He should train only for seclusion for that is highest for Noble ones. By that he should not conceive he is best. He truly is close to Nibbāna.	would train himself in seclusion— this, for the noble is highest. He wouldn’t, because of that, suppose himself to be better than others: He’s on the verge of unbinding.	So train yourself in solitude, for that’s the life of Noble Ones, but not conceive oneself as “best”— them near indeed to Nirvāṇa.		822	
10	4.7  TISSAMETTEYYA Disadvantages of Sex	rittassa munino carato kāmesu anapekkhino oghatiṇṇassa pihayanti kāmesu gadhitā pajāti	People tied to sensual pleasures envy them: the isolated, wandering sage who has crossed the flood, unconcerned for sensual pleasures.	“When the muni lives void, indifferent to sensual pleasures, people tied to sensual pleasures envy him as one who has crossed the flood.”	The Muni faring released unconcerned for sensual pleasures, crossed over the flood, those people envy who still are entangled in pleasures.	People enmeshed in sensual pleasures, envy him: a sage remote, leading his life unconcerned for sensual pleasures one who’s crossed over the flood.”	The sage who’s rid of sense-desires, who to them’s indifferent, who’s crossed the flood, is envied then, by those enmeshed with pleasures of sense		823	
1	4.8  PASŪRA Disadvantages of Debate	idheva suddhī iti vādayanti nāññesu dhammesu visuddhimāhu yaṃ nissitā tattha subhaṃ vadānā paccekasaccesu puthū niviṭṭhā	“Here alone is purity,” they say, denying that there is purification in other teachings. Speaking of the beauty in that which they depend on,  each one is dogmatic about their own idiosyncratic interpretation.	“‘Here alone is purity,’ they declare; they say there is no purification in other teachings. Declaring whatever they depend on to be excellent, many are entrenched in separate truths.	“Only here there is purity” they say, in regard to other teachings they do not speak of purity. In what they are depending upon, there they speak of ‘beauty’. In separate truths they are individually entrenched.	“‘Only here is there purity’ —that’s what they say— ‘No other doctrines are pure’ —so they say. Insisting that what they depend on is good, they are deeply entrenched in idiosyncratic truths.	They say: “In our Dharma purity’s found” but deny that it is found in the Dharma of others. On what they depend they say “it’s the best”, and so settle down in their individual truths		824	See also: MN 18; MN 36; MN 58; MN 101; SN 42:8; AN 2:36; AN 3:62; AN 3:68; AN 3:73
2	4.8  PASŪRA Disadvantages of Debate	te vādakāmā parisaṃ vigayha bālaṃ dahantī mithu aññamaññaṃ vadanti te aññasitā kathojjaṃ pasaṃsakāmā kusalā vadānā	Desiring debate, they plunge into an assembly, where each takes the other as a fool.  Relying on others they state their contention, desiring praise while claiming to be experts.	“Desiring debate, having plunged into the assembly, in pairs they accuse one another of being a fool. Those of different convictions assert their argument, desiring praise, claiming to be skilled.	Wanting to debate they plunge into the assembly and hold each other to be fools mutually. Depending upon others they put forth their arguments. Desirous of praise they claim to be experts.	Seeking controversy, they plunge into an assembly, regarding one another as fools. Relying on others’ authority, they speak in debate. Desiring praise, they claim to be skilled.	Those disputants into the assembly rush, and perceive opposedly “the other” as a fool. But in disputes, on others they rely— these so-called experts ever-loving praise.		825	Stories different in SpCm and Chinese and also some verses
3	4.8  PASŪRA Disadvantages of Debate	yutto kathāyaṃ parisāya majjhe pasaṃsamicchaṃ vinighāti hoti apāhatasmiṃ pana maṅku hoti nindāya so kuppati randhamesī	Addicted to debating in the midst of the assembly, their need for praise makes them nervous. But when they’re repudiated they get embarrassed; upset at criticism, they find fault in others.	“Keen on speaking in the midst of the assembly, wishing for praise, he becomes anxious. If his assertion is rejected, he feels humiliated. Upset by blame, he seeks a flaw [in his opponent].	Engaged in dispute in the midst of the assembly wanting praise he becomes anxious. When being refuted he becomes depressed. When blamed he gets irritated and looks for a flaw.	Engaged in disputes in the midst of the assembly, —anxious, desiring praise— the one defeated is chagrined. Shaken with criticism, he seeks for an opening.	Engrossed in conflict midst the assembly, fearing defeat, they wish only for praise, having been refuted, that one’s truly confused, angry at blame seeks weakness in the other		826	Being Overbold, the Disadvantages of Debate
4	4.8  PASŪRA Disadvantages of Debate	yamassa vādaṃ parihīnamāhu apāhataṃ pañhavimaṃsakāse paridevati socati hīnavādo upaccagā manti anutthunāti	If their doctrine is said to be weak, and judges declare it repudiated, the loser weeps and wails, moaning, “They beat me.”	“If they say his assertion is defective, and the judges consider it rejected, the loser laments and sorrows, he moans: ‘He surpassed me.’	Due to the fact that they say his view is inferior and refuted, those who are judging the questions, he laments and grieves, being the loser, and he wails “They went beyond me!”	He whose doctrine is [judged as] demolished, defeated, by those judging the issue: He laments, he grieves—the inferior exponent. ‘He beat me,’ he mourns.	“Through investigation is your argument refuted and destroyed”—so they say. That one grieves and laments—that mere arguer, “Oh! I am overcome” that person wails		827	
5	4.8  PASŪRA Disadvantages of Debate	ete vivādā samaṇesu jātā etesu ugghāti nighāti hoti etampi disvā virame kathojjaṃ na haññadatthatthi pasaṃsalābhā	When these arguments come up among ascetics, they get excited or dejected. Seeing this, refrain from contention, for the only purpose is praise and profit.	“These disputes have arisen among ascetics; in relation to them, one becomes elated and dejected. Having seen this, too, one should desist from arguments, for there is no other benefit than praise and gain.	Such are the disputes arisen among recluses. In these there are elation and depression. Seeing this one should avoid argumentation, for there is no other benefit than the gain of praise herein.	These disputes have arisen among contemplatives. In them are elation, dejection. Seeing this, one should abstain from disputes, for they have no other goal than the gaining of praise.	Arisen among monks—those controversies among them cause both elation and depression. Refrain therefore, from disputation! No meaning’s in it save the prize of praise		828	
6	4.8  PASŪRA Disadvantages of Debate	pasaṃsito vā pana tattha hoti akkhāya vādaṃ parisāya majjhe so hassatī unnamatī ca tena pappuyya tamatthaṃ yathā mano ahu	But if, having declared their doctrine, they are praised there in the midst of the assembly, they laugh and proudly show off because of it, having got what they wanted.	“If, however, he is praised there, having declared his doctrine in the midst of the assembly, he is thrilled by this and swells with pride, having obtained the benefit that accords with his wish.	If he gets praise there, however, having spoken his word in the midst of the assembly, he laughs and gets elated due to it having achieved the purpose his mind was set upon	While he who is praised there for expounding his doctrine in the midst of the assembly, laughs on that account &grows haughty, attaining his heart’s desire.	Praised in the midst of the assembly for the presentation of arguments, then that one laughs, or else is haughty. So they say, “Conceited by winning debate”.		829	
7	4.8  PASŪRA Disadvantages of Debate	yā unnatī sāssa vighātabhūmi mānātimānaṃ vadate paneso etampi disvā na vivādayetha na hi tena suddhiṃ kusalā vadanti	Their pride is their downfall, yet they speak from conceit and arrogance. Seeing this, one ought not get into arguments, for experts say this is no way to purity.	“Though his pride is the ground of distress, he yet speaks from conceit and arrogance. Having seen this, too, one should not dispute; for the skilled say this does not bring purity.	But that elation is a source of trouble for him, for it makes him talk out of conceit and arrogance. Having seen this too one should not dispute, for the skillful ones say there is no purity through that.	That haughtiness will be grounds for his damage, for he’ll speak in pride &conceit. Seeing this, one should abstain from debates. No purity is attained by them, say the skilled.	Though haughtiness will be ground for a downfall, still proudly that one speaks, and with arrogance: this having seen, refrain from disputations— not by that is there purity, so the skilled say.		830	
8	4.8  PASŪRA Disadvantages of Debate	sūro yathā rājakhādāya puṭṭho abhigajjameti paṭisūramicchaṃ yeneva so tena palehi sūra pubbeva natthi yadidaṃ yudhāya	As a warrior, after feasting on royal food, goes roaring, wanting an opponent— go off and find an opponent, Sūra, for here, as before, there is no-one to fight.	“Just as a hero, nourished on the king’s food, comes thundering, desiring an opponent, rush off in his direction, Sūra;197 already in the past, there was no scope for a fight.	Like a hero fed on royal food goes challengingly forth looking for a rival, you run to him, hero! For right in front of you there is naught to battle with	Like a strong man nourished on royal food, you prowl about, roaring, searching out an opponent. Wherever the battle is, go there, strong man. As before, there’s none here.	Just as a strong man, fed upon royal food, might roar forth, wishing for a champion rival, but finds from the first there’s nought to fight		831	
9	4.8  PASŪRA Disadvantages of Debate	ye diṭṭhimuggayha vivādayanti idameva saccanti ca vādayanti te tvaṃ vadassū na hi tedha atthi vādamhi jāte paṭisenikattā	When someone argues about a view they have adopted, saying, “This is the only truth,” say to them, “Here you’ll have no adversary when a dispute has come up.”	“When they grasp a view and argue, and assert, ‘This alone is true,’ [163] tell them: ‘When a debate has arisen there is no opponent for you here.’	To those who pick up a view and quarrel and say “This alone is the truth”, you should speak; for here you won’t find anyone to oppose you when a dispute has arisen	Those who dispute, taking hold of a view, saying, “This, and this only, is true,” those you can talk to. Here there is nothing— no confrontation at the birth of disputes.	Those holding a view and disputing, say thus: “This alone is the truth”, so they aver; then reply to them: “But no one’s here to retaliate through disputation”.		832	
10	4.8  PASŪRA Disadvantages of Debate	visenikatvā pana ye caranti diṭṭhīhi diṭṭhiṃ avirujjhamānā tesu tvaṃ kiṃ labhetho pasūra yesīdha natthī paramuggahītaṃ	There are those who live far from the crowd, not countering views with view. Who is there to argue with you, Pasūra, among those who grasp nothing here as the highest?	“But among those who live remote, who do not oppose a view with other views, what will you obtain, Pasūra, from those who grasp nothing here as supreme?	But those who fare along freed from opposition without countering views with views, among them what will you get, Pasūra, those for whom there is nothing grasped as the highest?	Whom would you gain as opponent, Pasūra, among those who live above confrontation— not pitting view against view— who have nothing here grasped as supreme?	They continue with their practice, offering no opposition against others, offering no view opposed to view. But then, Pasūra, what would you obtain? For them there is nothing to be grasped as the highest		833	
11	4.8  PASŪRA Disadvantages of Debate	atha tvaṃ pavitakkamāgamā manasā diṭṭhigatāni cintayanto dhonena yugaṃ samāgamā na hi tvaṃ sakkhasi sampayātaveti	And so you come along speculating, thinking up theories in your mind. Now that you’ve challenged someone who’s cleansed,  you’ll not be able to respond	“But now you have come brooding, devising speculative views in your mind. You have confronted one who is cleansed: indeed, you won’t be able to succeed.”	You came along in speculation thinking out view-issues in your mind. You came face to face with the cleansed one, you won’t be able to sort yourself out	So here you come, conjecturing, your mind thinking up viewpoints. You’re paired off with a pure one and so cannot proceed.”	As you’ve come here, in your mind thinking and speculating on various views, you have met with a Washed One But will not be able to make progress with him		834	Here, yuga is connected in the Niddesa with yugaggāha (“taking the reins”), which in turn is connected in Vb 17:75.2 with “causing disputes”. It seems to be an idiom for “issuing a challenge”. In any case, it has a stronger sense than just “met, encountered”.
